"AccessionNum","SE","HD","BY","WC","PD","SN","SC","ED","PG","VOL","LA","CY","LP","TD","PUB"
"Document USAT000020230104ej140000h","	NEWS","	4 people survive Tesla plunge off cliff","	Natalie Neysa Alund","	564 words","	4 January 2023","	USA Today","	USAT",NA,"	A.5"," 	ISSN:07347456","	English","	© 2023 USA Today. Provided by ProQuest Information and Learning. All Rights Reserved.","  In what Northern California first responders are calling a miracle, four people survived an incredible single-vehicle crash after a Tesla dove off a cliff along the Pacific Coast Highway Monday morning.  A 4-year-old girl, a 9-year-old boy and two adults suffered serious injuries after the sedan they were riding in plunged hundreds of feet off a cliff along State Route 1 near Devil's Slide – an area known for fatal wrecks, officials with Coastside Fire Protection District/Cal Fire reported. ","  The vehicle apparently flipped a few times before landing on its wheels, wedged against the cliff just feet from the surf, Brian Pottenger, a battalion chief with the agency, said at the scene.  On Monday afternoon, Cal Fire San Mateo's Santa Cruz Unit shared a video letting drivers in the area know that the car went over the cliff and there would be delays along the coastal roadway.  The victims were initially listed in critical condition but all four were conscious and alert when rescuers arrived.  The Tesla plummeted more than 250 feet from the highway and crashed into a rocky outcropping, officials said. Pottenger said the vehicle flipped several times before landing on its wheels, wedged against the cliff just feet from the surf.  Neither CAL Fire nor the California Highway Patrol could immediately be reached for comment by USA TODAY Tuesday morning for an update on the victims' conditions.  Officials did not provide the victims' names or say where they are from.  Crashes along Devil's Slide, a steep, rocky and winding coastal area about 20 miles south of San Francisco between Pacifica and Montara, rarely end with survivors.  ""We go there all the time for cars over the cliff and they never live. This was an absolute miracle,"" Pottenger said.  Watching through binoculars  Pottenger said witnesses called 911 at 10:15 a.m. and responding crews set up a rope system from the highway to lower firefighters down the cliff.  At the same time, he said, other firefighters watching the sedan through binoculars noticed movement – a sign that at least one person was still alive.  ""Every one of us was shocked when we saw movement out of the front windshield,"" Pottenger said.  The incident turned from what had been likely a recovery of bodies to a rescue operation that took several hours amid constant rain, heavy winds, slick roads and crashing waves. The doors were smashed against the cliff and jammed shut, so firefighters were forced to cut the victims out of the car using the so-called ""jaws of life"" tools.  Crews pulled the two children out of the Tesla's back window and brought them up the cliff in a basket using a rope. They were rushed to the hospital by ambulance to be treated for musculoskeletal injuries, officials reported.  Based on the California Highway Patrol's initial investigation, troopers do not believe the Tesla was operating in Autopilot or Full Self-Driving mode at the time, Officer Mark Andrews said.  The road's conditions also were not believed to be a factor in the crash. There was no guardrail at the spot where the sedan went off the cliff.  ""The car traveled off the main portion of the roadway. For what reason, we don't know,"" Andrews said.  Contributing: The Associated Press   NS 	 gtacc : Transport Accidents | gmmdis : Accidents/Man-made Disasters | gcat : Political/General News | gdis : Disasters/Accidents | gtrans : Transport  RE 	 usca : California | namz : North America | usa : United States | usw : Western U.S.  IPD 	 Newspapers | USA Today, a division of Gannett Satellite Information Network, Inc. | News  PUB 	 USA Today Information Network ",NA
"Document USAT000020210817eh8h0000p","	MONEY","	Tesla Autopilot faces probe over series of accidents","	Nathan Bomey","	375 words","	17 August 2021","	USA Today","	USAT",NA,"	B.3"," 	ISSN:07347456","	English","	© 2021 USA Today. Provided by ProQuest Information and Learning. All Rights Reserved.","  U.S. auto safety regulators launched an investigation into Tesla's partially self-driving car system after nearly a dozen reports of the company's vehicles crashing into cars at the scenes of incidents involving emergency responders.  The National Highway Traffic Safety Administration opened the probe Friday into Tesla's Autopilot, which steers, brakes and accelerates the vehicle on most roads with lanes. ","  Though the system can drive the vehicle on its own in many circumstances, drivers are supposed to keep their hands on the wheel in case they need to take over when Autopilot encounters a situation that's too complex for it to handle on its own.  The National Transportation Safety Board and NHTSA have investigated Autopilot multiple times, including after a crash in 2016 that killed a man in Florida who authorities said had too much confidence in the system's capabilities. Safety watchdogs have criticized Tesla for exaggerating Autopilot's functions, but Tesla CEO Elon Musk argued that the system is safer than human drivers.  In May, a deadly crash in Texas involving an Autopilot vehicle called attention to the fact that drivers can trick Autopilot into thinking someone's behind the wheel even if no one is.  Tesla owners have posted photos to YouTube showing themselves abusing the technology by riding in the back seat while the vehicle drives itself.  Soon after the Texas incident, Tesla announced it was activating cameras to monitor whether drivers are paying attention to the road while using Autopilot.  In the newest probe, NHTSA investigators identified 11 crashes since January 2018 ""in which Tesla models of various configurations have encountered first responder scenes and subsequently struck one or more vehicles involved with those scenes,"" according to an Office of Defects Investigation document. ""Most incidents took place after dark and the crash scenes encountered included scene control measures such as first responder vehicle lights, flares, an illuminated arrow board, and road cones. The involved subject vehicles were all confirmed to have been engaged in either Autopilot or Traffic Aware Cruise Control during the approach to the crashes.""  Tesla did not respond to a request seeking comment. The company eliminated its media relations department in the past year.   CO 	 nathg : National Highway Traffic Safety Administration  NS 	 gtacc : Transport Accidents | gcat : Political/General News | gdis : Disasters/Accidents | gmmdis : Accidents/Man-made Disasters | gtrans : Transport  RE 	 ustx : Texas | usa : United States | namz : North America | uss : Southern U.S.  IPD 	 Newspapers | USA Today, a division of Gannett Satellite Information Network, Inc. | News  PUB 	 USA Today Information Network ",NA
"Document USAT000020210713eh7d00002","	MONEY","	Tesla updates its self-driving software","	Charisse Jones","	275 words","	13 July 2021","	USA Today","	USAT",NA,"	B.3"," 	ISSN:07347456","	English","	© 2021 USA Today. Provided by ProQuest Information and Learning. All Rights Reserved.","  Tesla owners who want to tap into a self-driving feature when traveling local streets got a boost this weekend, when the electric car maker began releasing a much-anticipated software update, reports say.  The updates to the Full Self-Driving beta version 9 became available Saturday according to tech publication The Verge, and Electrek, a news site dedicated to reports about Tesla and other electric vehicles. ","  The update expands assisted driving capabilities for a small pool of Tesla owners who get to try out features early, according to Electrek.  Tesla's assisted driving programs have come under scrutiny in the wake of several accidents involving Teslas, including some that were in Autopilot mode.  Since those incidents, federal transportation officials have said Tesla has done an inadequate job of monitoring drivers to make sure they are engaged and also has permitted the Autopilot feature to be used on roads where it's not suitable.  The car maker appeared to address some of those concerns in notes connected to the release of the software update, warning drivers to use the Full Self-Driving feature ""only if you will pay constant attention to the road and be prepared to act immediately, especially around blind corners, crossing intersections and in narrow driving situations,"" according to Electrek.  Tesla also reportedly began activating the in-car camera in its vehicles in May to keep track of attentiveness when drivers use the partially self-driving technology.  The new software update has been touted for the past three years with Elon Musk, Tesla's founder, repeatedly saying it was on its way, reports say.   CO 	 teslmi : Tesla, Inc.  IN 	 i35101 : Passenger Cars | i35104 : Alternative Fuel Vehicles | iaut : Automotive | i351 : Motor Vehicles  NS 	 ccat : Corporate/Industrial News  RE 	 usa : United States | namz : North America  IPD 	 Newspapers | USA Today, a division of Gannett Satellite Information Network, Inc. | News  PUB 	 USA Today Information Network ",NA
"Document USAT000020210709eh790002t","	MONEY","	Driverless electric cars to hit Vegas","	Mike Snider","	879 words","	9 July 2021","	USA Today","	USAT",NA,"	B.4"," 	ISSN:07347456","	English","	© 2021 USA Today. Provided by ProQuest Information and Learning. All Rights Reserved.","  Here's a new twist in self-driving cars: Your ride arrives and it's an electric vehicle with no driver. Then, you drive your rental car where you want and once you arrive, you exit the vehicle and it takes off on its own.  Later this year, Las Vegas will be the testing ground for a pilot program sending driverless EVs, driven by a remote pilot, to customers who order a car via a mobile app. When the car arrives, the driver gets in and drives to his destination. After the rental driver leaves, the remote driver directs the EV to its next location. ","  Autonomous and driverless car technology company Halo plans to make the service available initially in urban parts of the Las Vegas Valley. Remote drivers have a 360-degree video view – just as if they were in the car – and additional sensors eliminate blind spots. Video and data are sent via T-Mobile's 5G network, the provider and Halo announced Thursday.  ""You push a button and summon an electric car. It just comes to your doorstep,"" Anand Nandakumar, the founder and CEO of Halo, told USA TODAY. ""You hop in and you drive the car to your destination and once you are done, hop off and walk away and the car just disappears.""  5G behind driverless 'magic'  T-Mobile, which launched its consumer 5G network last year, also in 2020 co-founded the 5G Open Innovation Lab along with several other tech companies including Dell, Intel and Microsoft. Halo has been in stealth mode for two years.  Despite the potential benefits of 5G connectivity including faster data speeds on smartphones and a growing network of internet-connected devices, there's not many real-world examples of how 5G can change things. Halo's remote-piloted cars could change that.  ""So many industries are already being transformed today by 5G, and it's the startups and entrepreneurs – developers like Halo – that are making the magic happen,"" said T-Mobile CEO Mike Sievert in a statement to USA TODAY. ""True, nationwide 5G is powering groundbreaking new products and services that will change nearly every facet of our world, connecting people and things at massive scale.""  Originally based in the San Francisco Bay Area, Halo began testing remote control of EVs in California in August 2020. In February, the company moved its testing to Las Vegas, where Halo is now headquartered.  In addition to remote drivers piloting the Kia Niro crossover SUVs from Halo's mission control, Halo equips the vehicles with an artificial intelligence-driven ""Advanced Safe Stop mechanism"" that automatically brings the cars to a full stop when there's a potential safety hazard, the company said.  Risks in self-driving car tests  The development of self-driving cars has been underway for more than four years with big tech names such as Amazon, Apple and Google's parent company Alphabet involved, along with Tesla, Ford, GM and other auto makers.  But there have been setbacks such as the April crash of a Tesla in the Houston area that killed two passengers. In that case, the National Transportation Safety Board said in a preliminary report the driver had been behind the wheel but came to no conclusions about the crash's cause. Tesla says on its website that drivers are supposed to keep their hands on the wheel at all times, ready to take over when the semi-autonomous system is not able to steer, accelerate or brake on its own.  Uber sold its self-driving division last year to Aurora, a startup headed by Chris Urmson, who had led Google's autonomous vehicle efforts. That came after a self-driving Uber vehicle, with a backup operator in the driver's seat, fatally hit a 49-year-old woman in Tempe, Arizona, in March 2018. (Uber invested $400 million in Aurora, which is backed by Amazon, and Uber CEO Dara Khosrowshahi joined the startup's board.  Las Vegas has been a hotspot for the testing of self-driving vehicles with demonstrations held during the Consumer Electronics Show beginning in January 2017. Between May 2018 and February 2020 in Las Vegas, Lyft and autonomous tech company Aptiv delivered more than 100,000 robotaxi self-driving rides, with a human driver sitting in the driver's seat. Lyft sold its self-driving unit in April to Woven Planet Holdings for about $550 million.  Halo's program seeks to build trust in autonomous vehicles, as well as increase the use of electric cars, Nandakumar said. ""Consumers never get an opportunity to actually see an autonomous car deployed on public roads. They never get a chance to interact with it or take rides with it,"" he said.  Pricing has not been announced, but Halo rides will be ""highly affordable for everyone,"" the companies said.  Beyond that, Halo's service seeks to solve the problem of ""the last mile between your last transit stop and your workplace or your home,"" said John Saw, executive vice president of advanced and emerging tech at T-Mobile. ""It helps us show the world, hey, we are not just talking about it but we are showing what we can do with 5G.""  Contributing: Nathan Bomey   IN 	 i8395464 : Internet Search Engines | i35104 : Alternative Fuel Vehicles | i35101 : Passenger Cars | iadrive : Autonomous Driving Technologies | iaut : Automotive | iautlsg : Vehicle Rental/Leasing | iint : Online Service Providers | i351 : Motor Vehicles | i84 : Rental/Leasing Services | ibcs : Business/Consumer Services | itech : Technology  NS 	 gcar : Cars | ccat : Corporate/Industrial News | reqrau : Suggested Reading Automobiles | reqrio : Suggested Reading Internet/Online Services | gcat : Political/General News | glife : Living/Lifestyle | redit : Selection of Top Stories/Trends/Analysis | reqr : Suggested Reading Industry News  RE 	 lvegas : Las Vegas | usnv : Nevada | namz : North America | usa : United States | usw : Western U.S.  IPD 	 Newspapers | USA Today, a division of Gannett Satellite Information Network, Inc. | News  PUB 	 USA Today Information Network ",NA
