"AccessionNum","SE","HD","BY","WC","PD","SN","SC","ED","PG","VOL","LA","CY","LP","TD","PUB"
"Document USAT000020210317eh3h00010","	MONEY","	MONEYLINE","","	298 words","	17 March 2021","	USA Today","	USAT",NA,"	B.1"," 	ISSN:07347456","	English","	© 2021 USA Today. Provided by ProQuest Information and Learning. All Rights Reserved.","  Feds probe tesla crash  The National Highway Traffic Safety Administration was sending a special crash investigation team to Detroit to investigate a crash involving a Tesla that drove beneath a semitrailer. Two people were critically injured in the crash that happened last Thursday on the city's southwest side. The crash circumstances are similar to two others in Florida in which Teslas drove beneath tractor-trailers, causing two deaths. In both crashes, in 2016 and 2019, the cars were being driven while using Tesla's Autopilot partially automated driving software. ","  Fortnite goes primal  Forget about finding weapons in Fortnite. The video game's latest season will let players make their own. Season 6 of Fortnite Chapter 2, nicknamed Primal, launched on Tuesday, introducing new features such as the option to create makeshift weapons and the introduction of wild animals. The Primal season will also add several new characters players can use, including Tomb Raider heroine Lara Croft and soccer star Neymar Jr. Details on Neymar's arrival are coming soon, said publisher Epic Games.  Czech chimps online  A zoo in the Czech Republic is trying out a new way for its bored chimpanzees to monkey around during the coronavirus lockdown: face time with other primates. The Safari Park in the northern town of Dvur Kralove installed a big screen in their enclosure to show them a livestream of what their fellow chimpanzees are doing on the other side of the country at a zoo in the southern city of Brno. The Safari Park launched the experimental project Thursday to enrich the everyday life of their six chimpanzees amid a strict lockdown and give them some fun after crowds of visitors disappeared when the zoo closed on Dec.18. It's not clear when zoos will reopen.   NS 	 gmmdis : Accidents/Man-made Disasters | gdis : Disasters/Accidents | gtacc : Transport Accidents | gcat : Political/General News | gtrans : Transport  RE 	 usa : United States | namz : North America  IPD 	 Newspapers | USA Today, a division of Gannett Satellite Information Network, Inc. | News  PUB 	 USA Today Information Network ",NA
"Document USAT000020201119egbj00018","	MONEY","	GM to offer auto insurance and vows lower rates","	Nathan Bomey","	935 words","	19 November 2020","	USA Today","	USAT",NA,"	B.1"," 	ISSN:07347456","	English","	© 2020 USA Today. Provided by ProQuest Information and Learning. All Rights Reserved.","  Vehicle owners could soon buy insurance directly from car companies that are promising lower rates to motorists who drive safely.  General Motors announced Wednesday that it is launching OnStar Insurance with plans to make it available to the public by early next year and go nationwide by the end of 2021. The name comes from the brand GM has long used on the safety-and-security communication system embedded in its vehicles. ","  Tesla recently began selling insurance to its vehicle owners in California with plans to expand to other states, and several other automakers have partnered with insurance companies to offer policies to their customers.  Yet GM is expected to sell its own insurance policies to all vehicles, including non-GM cars, trucks and SUVs, as well as homeowners and renters insurance, through its new agency, OnStar Insurance Services.  The automaker said it eventually will tie auto insurance rates directly to the consenting driver's performance based on driving data wirelessly collected from the vehicle, rather than educational history and other personal factors.  OnStar Insurance President Andrew Rose declined to provide an estimate for how much the average driver might save since it's dependent on so many variables, including the kind of car they drive, their road habits and their location. But he said the savings will be ""significant.""  The average American is expected to pay about $1,463 for insurance in 2020, according to policy comparison site Insurify.  ""You'll have the opportunity over time to have greater control over your pricing,"" Rose said. ""We know your vehicle better than anybody else and, if you consent, we will use your information on how you drive your vehicle to demonstrate that you're a better driver and thus lower your"" prices.  It could be hard to get Americans to switch. About 2 in 3 consumers don't shop around for a better deal when their policy is up for renewal, according to a survey by LendingTree. The older you get, the less likely you are to switch.  But the chance to save money could be a significant lure, especially during these tough economic times, said Andrew Hurst, who analyzes insurance trends for LendingTree.  ""Most people fancy themselves as pretty good drivers, so they're intrigued by the notion that they'll be rewarded for that,"" Hurst said.  To be sure, most major insurers and various upstarts already offer some form of policy that considers the policy holder's driving habits. But those policies typically require the driver to consent to providing that data through an onboard device.  ""They're able to track how you're driving, when you're driving, where you're driving,"" said Kyle Schmitt, vice president and global managing director of J.D. Power's insurance industry division. ""Are you braking hard? Are you using your phone while you're driving? They can now at least rudimentarily and, in many cases, quite sophisticatedly measure these types of things.""  Good drivers get lower rates. Bad drivers? Expect more conventional premiums.  ""If you behave poorly, you pretty much know where the ceiling is,"" Schmitt said.  Privacy concerns  A majority of drivers haven't yet opted in, according to industry experts. Many have been wary of handing over their data without getting something concrete in return.  ""For them to start making that trade-off, they need to start seeing some pretty substantial discounts,"" Schmitt said.  Rose said that the benefits of providing access to vehicle driving data will extend beyond savings. In the future, he said, GM will introduce technology that enables its vehicles to notify emergency responders and OnStar Insurance when an accident occurs so that the insurance claims process and repairs can begin quickly.  OnStar Insurance will be sold primarily through a website, though it will have call centers. Rose said GM would not place insurance agents in dealerships, though he said dealers could help car buyers obtain policies online.  Self-driving cars change game  The move to start an insurance agency harkens back to the days when GM was a sprawling company with wide-ranging products and services. The automaker sold insurance through its GMAC unit for several decades before running into financial troubles and selling off the division in 2008. GMAC rebranded as Ally.  More car companies will be attracted by the possibility of gaining additional revenue from insurance, but the ""biggest value"" is a ""deeper relationship with their customers,"" Insurify CEO Snejina Zacharia said.  ""People want to feel empowered that they're making the best decision for themselves,"" she said.  One X factor in the insurance business is the emergence of autonomous vehicle technology, including systems, like Tesla's Autopilot and GM's Super Cruise, that partially drive the vehicle on behalf of the motorist.  As self-driving car technology becomes a reality in years to come, some insurance industry experts believe that rates will fall sharply because there will be fewer crashes. That may mean less profit for insurers.  But Rose said ""there's going to be a need for auto insurance for a significant period of time,"" and when autonomous vehicles become a reality, ""you're still going to have tree branches that fall on cars.""  Launching an insurance business from scratch takes an investment in actuarial science, advertising and regulatory teams that can navigate the different insurance laws in the 50 states.  One advantage for automakers is that they are already spending heavily on advertising and could potentially begin appending their marketing with information on their insurance plans.  ""They have deep pockets,"" Schmitt said.   CO 	 gnmoc : General Motors Company  IN 	 i82 : Insurance | i8200316 : Vehicle Insurance | i82003 : Non-life Insurance | iadrive : Autonomous Driving Technologies | iaut : Automotive | icaslty : Property/Casualty Insurance | ifinal : Financial Services | itech : Technology | itfins : Transport/Freight Insurance | i351 : Motor Vehicles | i35101 : Passenger Cars  NS 	 ccat : Corporate/Industrial News | reqrin : Suggested Reading Insurance | redit : Selection of Top Stories/Trends/Analysis | reqr : Suggested Reading Industry News  RE 	 usa : United States | namz : North America  IPD 	 Newspapers | USA Today, a division of Gannett Satellite Information Network, Inc. | News  PUB 	 USA Today Information Network ",NA
"Document USAT000020201030egau0000x","	MONEY","	Thermal cameras could help cars see well at night","	Eric D Lawrence","	1046 words","	30 October 2020","	USA Today","	USAT",NA,"	B.3"," 	ISSN:07347456","	English","	© 2020 USA Today. Provided by ProQuest Information and Learning. All Rights Reserved.","  No one was crossing Kercheval Avenue on The Hill in Grosse Pointe Farms, Michigan, as a minivan made its way through the shopping district one evening this fall, but people were clearly nearby.  They could be seen there on the laptop screen from inside the vehicle, their presence confirmed by glowing images captured by a thermal camera. ","  But the pedestrians weren't on the street, and it took a moment to realize that they were actually on the sidewalk, obscured by decorative plantings and the darkness that coated everything not illuminated.  It wasn't a great night for spotting pedestrians on this particular weeknight on a drive through a couple of the Grosse Pointes and the east side of Detroit. Maybe the pandemic was keeping people inside. Those who were out, however, were not hard to see, at least on the screen.  The eyeball view through the windshield was a different story, with darkness providing an effective camouflage. And darkness can be deadly for pedestrians.  Most pedestrians who die in crashes are killed at night, but nighttime has been when the technology designed to prevent pedestrian crashes struggles most.  Last year, AAA revealed some startling deficiencies in driver assistance systems designed to protect pedestrians.  At night, several test vehicles equipped with automatic emergency braking systems and pedestrian detection were found to be ""completely ineffective."" Rather than bash the automakers' efforts, AAA encouraged continued development of systems because of the scope of the pedestrian death crisis in this country.  But finding a solution as the deaths of so many Americans on and along our roads has continued to rise – 6,283 men, women and children in 2018 alone, according to federal statistics – has become more urgent. The National Highway Traffic Safety Administration even designated October as the first national Pedestrian Safety Month, an acknowledgment of the dangers faced by vulnerable road users. A 2018 Detroit Free Press/USA TODAY investigation highlighted the role the increase in large vehicles, such as SUVs, has played in the rising number of deaths.  Vehicle technology is one way to improve protection for pedestrians at night, and a couple of thermal imaging companies are promoting their systems as the answer. Thermal imaging already is having a bit of a moment this year in light of the COVID-19 pandemic. Thermal cameras can be used to detect elevated body temperatures at a distance. That allows them to function as an initial screening in such places as auto plants to monitor for people who could be feverish, a potential symptom of the virus.  Results of thermal testing in Michigan appear to show promise in the realm of pedestrian detection at night, too.  U.S.-based Flir Systems, along with VSI Labs, tested an automatic emergency braking system at the American Center for Mobility in Ypsilanti Township. The tests ""fused"" data from thermal sensing with radar, a nonthermal camera and a computer network. The test vehicle, a Ford Fusion equipped with Flir's system, managed to avoid heated targets designed to appear as a child or an adult in all but two tries out of more than two dozen. In the two cases where the car touched the targets, it did not knock them down.  In contrast, four other test vehicles not equipped with Flir's technology – a BMW X7, Subaru Forrester, Toyota Corolla and Tesla Model 3 – all failed in night testing by hitting the targets. They performed much better during daylight testing although only the X7 managed to get through each of those tests without hitting the target, according to Flir.  ""We were able to stop really successfully at night,"" explained Mike Walters, a Flir vice president.  He described the instances where the Flir-equipped Fusion made contact with the targets as a minor touch rather than a full hit, something that can be fixed with adjustments to the system in future testing.  That would be a far cry from what was seen in videos shown as part of AAA's testing, with a 2019 Chevrolet Malibu, Honda Accord, Tesla Model 3 and Toyota Camry plowing into targets in many cases.  Thermal cameras have been pitched as a way to help advanced driver assistance systems and someday actual self-driving systems ""see"" pedestrians and even deer on the roads. But it's the focus on nighttime applications, which is what Flir and Adasky, a competitor from Israel, are discussing. With three-quarters of fatal pedestrian deaths happening in nighttime crashes, systems that work well only during daylight hours would appear to have limited appeal.  The recent nighttime drive around Detroit's east side and the Grosse Pointes in a minivan equipped with Adasky's thermal camera showed the technology at work. The setup was not designed to brake for anyone crossing the road but instead to show via a laptop display what the camera can pick up. A reporter, who had been on a previous drive in daylight, could see clearly on the screen when people, even in dark clothing on a dark street, were nearby. In several cases, pedestrians and cyclists were very difficult to see with the naked eye, but their heat signature was visible on the screen. A couple of instances showed a slight delay in the image appearing, but the man behind the wheel, Bill Grabowski, head of Adasky, North America, said the system can be adjusted to account for that as well.  Most experts promote the idea of using several different types of sensors for automatic emergency braking systems. Thermal cameras can detect people and animals in conditions, such as at night and in the rain, that might be a challenge for other types of sensors.  ""It's going to fill the gap in the edge cases that all these other sensors can't hit,"" Grabowski said of cameras.  David Zuby, chief research officer at the Insurance Institute for Highway Safety, said thermal technology appears to offer promise, but his Virginia-based group has not yet been able to do a comparison.  However, Zuby said automakers will need to address nighttime driving conditions.  ""The infrared technology might be a good technology for achieving that,"" he said, noting that other combinations and better headlights could work.   IN 	 i353 : Motor Vehicle Parts | iaut : Automotive  NS 	 gcar : Cars | gtacc : Transport Accidents | reqrau : Suggested Reading Automobiles | gcat : Political/General News | gdis : Disasters/Accidents | glife : Living/Lifestyle | gmmdis : Accidents/Man-made Disasters | gtrans : Transport | redit : Selection of Top Stories/Trends/Analysis | reqr : Suggested Reading Industry News  RE 	 usmi : Michigan | detroi : Detroit | namz : North America | usa : United States | usc : Midwest U.S.  IPD 	 Newspapers | USA Today, a division of Gannett Satellite Information Network, Inc. | News  PUB 	 USA Today Information Network ",NA
"Document USAT000020200929eg9t0001f","	MONEY","	Technology could drive your choice of a new car","	Marc Saltzman","	944 words","	29 September 2020","	USA Today","	USAT",NA,"	B.4"," 	ISSN:07347456","	English","	© 2020 USA Today. Provided by ProQuest Information and Learning. All Rights Reserved.","  What do automotive shoppers really want?  A few years ago, those who kicked the tires on new vehicles might have prioritized fuel efficiency, comfort or horsepower. ","  Today, it's all about the tech.  ""The race never ends to develop 'must have' vehicle technologies,"" says Kristin Kolodge, executive director of driver interaction and human machine interface research at J.D. Power. ""New technology continues to be a primary factor in the vehicle purchase decision.""  Automotive expert Nik Miles echoes Kolodge's assessment: ""Besides price, tech plays a major role when considering a new car – interestingly, for every age group – but it has to be easy to use.""  Miles is founder and host of OurAutoExpert.com. ""Even inexpensive vehicles are loaded with tech, whether it's tech you see, such as cutting-edge infotainment systems, or tech you don't see that keeps drivers safe,"" Miles says.  The following is a quick look at a few promising teched-out vehicles this fall.  2021 Toyota Venza  Starting at $32,470, this new two-row crossover SUV features Toyota Safety Sense 2.5, a comprehensive suite of active safety systems that includes a pre-collision system with advanced pedestrian and bicyclist detection; road sign assist, which actively scans the sides of the road to detect select road signs and displays them on the dashboard; and emergency steering assist, which could help drivers avoid a pedestrian or other object.  The 2021 Toyota Venza features lane departure alert, lane tracing assist and dynamic cruise control.  In a first for the company, the vehicle supports an optional Star Gaze fixed panoramic moonroof. Similar to some airplanes that use this technology to block outside light, this is electrochromic glass that allows drivers to switch from transparent to frosted modes with the push of a button. This is a $1,400 option on the LTD grade of the vehicle (which includes a 12.3-inch touchscreen).  Ford Mustang Mach-E  Speaking of firsts, Ford is expanding its Mustang lineup for the first time in 55 years, with an all-electric model.  The Mach-E (from $44,995) is a four-door SUV that has similar hallmarks to the company's iconic muscle car – in its design and performance – and can go from 0 to 60 in about three and a half seconds for the GT Performance Edition package (about $60,000).  Aside from a ton of power and torque, this electric vehicle (EV) crossover has an estimated range of at least 300 miles, with the available extended-range battery and rear-wheel drive. It can route customers to nearby public charging stations and will provide access to more than 12,500 public charge stations in the FordPass network.  2021 Cadillac Escalade  When it comes to semiautonomous driving aids, the 2021 Cadillac Escalade (from $77,490) features an enhanced Super Cruise system, which includes ""lane change on-demand,"" allowing drivers to direct the system to perform a single lane change using the turn signal to indicate the desired direction of the move.  Speaking of lanes, an enhancement to ""dynamic lane offset"" means the Escalade can be nudged slightly into its lane when other vehicles pass closely.  When activated on supported freeways and highways, Super Cruise uses lidar-generated maps, high-precision GPS, cameras and radar sensors to monitor the road, as well as a system to ensure the driver is paying attention. Unlike Tesla's Autopilot, Cadillac's Super Cruise on the 2021 Escalade (or CT6 sedan) does not require motorists' hands on the wheel, but their eyes must remain fixed on the road ahead.  Along with augmented reality (AR)-enabled navigation – which uses live street views to enhance driving directions – the Escalade has an industry-first curved OLED display, which is as thin as a sheet of paper. In total, there are more than 38 inches of screen tech, with twice the pixel density of a 4K television.  Out this fall, the OLED display and AR Navigation come standard with the 2021 Escalade, while the Super Cruise feature costs about $2,500, available on the Premium Luxury, Sports and Platinum trims.  Other tech  Dashboard cameras (""dashcams"") give you peace of mind in case of an incident on the road (or interaction with authorities). The Sylvania Roadsight dash camera line offers a wide-angle HD camera system that loops video recordings of road interactions and automatically saves footage in the event of a detected accident (G-sensor technology). Unlike many other dashcams, the camera connects via its dedicated Wi-Fi to the SYLVANIA Connect mobile app (iOS and Android), which allows drivers to view a live-feed of the camera, adjust settings and download and share footage. Prices start at $59 for the Sylvania Roadsight Rear and up to $149 for the Roadsight Pro model.  Though you may have Siri or Google Assistant to talk to behind the wheel – via Apple CarPlay or Android Auto, respectively – if you prefer Alexa, there's an inexpensive way to add ""her"" to any vehicle. Called Amazon's Echo Auto ($49), this device connects to the Alexa app on your phone and plays through your car's speakers, through wireless Bluetooth or an available aux-in port. Echo Auto features eight microphones and far-field technology, so it can clearly hear you over music, air conditioning, and outside road noise. Along with using your voice to check the news, weather, manage your calendar or make calls, you can also stream content from Audible (audiobooks), Spotify (music and podcasts), Amazon Music, Apple Music, SiriusXM, and radio stations with TuneIn and iHeartRadio. An air vent mount is included.   NS 	 gcar : Cars | gent : Arts/Entertainment | gmusic : Music | gcat : Political/General News | glife : Living/Lifestyle  RE 	 usa : United States | namz : North America  IPD 	 Newspapers | USA Today, a division of Gannett Satellite Information Network, Inc. | News  PUB 	 USA Today Information Network ",NA
